760429,30074,"Aluminium; alloys, bars, rods and profiles, other than hollow",FALSE,,,,,,,,,,,,,,,,
940161,30266,"Seats; with wooden frames, upholstered, (excluding medical, surgical, dental, veterinary or barber furniture)",FALSE,,,,,,,,,,,,,,,,
820890,30358,"Tools; knives and cutting blades, for machines or mechanical appliances, n.e.c. in heading no. 8208",FALSE,,,,,,,,,,,,,,,,
400941,30514,"Rubber; vulcanised (other than hard rubber), tubing, piping and hoses, reinforced or otherwise combined with materials other than metal or textiles, without fittings",FALSE,,,,,,,,,,,,,,,,
620332,30606,"Jackets and blazers; men's or boys', of cotton (not knitted or crocheted)",FALSE,,,,,,,,,,,,,,,,
391190,30753,"Polysulphides, polysulphones and similar products of chemical synthesis n.e.c. in chapter 39; in primary forms",FALSE,,,,,,,,,,,,,,,,
392220,30817,Plastics; lavatory seats and covers,FALSE,,,,,,,,,,,,,,,,
830250,31046,"Hat-racks, hat-pegs, brackets and similar fixtures, of base metal",FALSE,,,,,,,,,,,,,,,,
900691,31175,"Cameras, photographic (excluding cinematographic); parts and accessories",FALSE,,,,,,,,,,,,,,,,
847490,31395,"Machines, for sorting, screening, separating, washing, crushing etc mineral substances, for agglomerating, shaping or moulding solid fuels, ceramic pastes etc, for forming foundry moulds of sand; parts",FALSE,,,,,,,,,,,,,,,,
810210,31422,"Molybdenum; articles thereof, including waste and scrap, powders",FALSE,,,,,,,,,,,,,,,,
901813,31835,"Medical, surgical instruments and appliances; magnetic resonance imaging apparatus",FALSE,,,,,,,,,,,,,,,,
853229,31835,"Electrical capacitors; fixed, n.e.c. in heading no. 8532",FALSE,,,,,,,,,,,,,,,,
730520,31881,"Iron or steel (excluding cast iron); casing of a kind used in drilling for oil or gas (not seamless), having circular cross-sections, external diameter exceeds 406.4mm",FALSE,,,,,,,,,,,,,,,,
392490,31899,Plastics; household articles and hygienic or toilet articles,FALSE,,,,,,,,,,,,,,,,
853949,31918,"Lamps; ultra-violet or infra-red lamps, (excluding arc-lamps)",FALSE,,,,,,,,,,,,,,,,
460199,31945,"Plaiting materials, plaits and similar products of plaiting materials; products of non-vegetable materials",FALSE,,,,,,,,,,,,,,,,
853590,31973,"Electrical apparatus; n.e.c. in heading no. 8535, for switching or protecting electrical circuits, for a voltage exceeding 1000 volts",FALSE,,,,,,,,,,,,,,,,
293379,32074,Heterocyclic compounds; lactams; other than 6-hexanelactam (epsilon caprolactam) and clobazam (INN) and methyprylon (INN),FALSE,,,,,,,,,,,,,,,,
283990,32110,"Silicates; commercial alkali metal silicates, other than of sodium",FALSE,,,,,,,,,,,,,,,,
841590,32835,"Air conditioning machines; with motor driven fan and elements for temperature control, parts thereof",FALSE,,,,,,,,,,,,,,,,
846090,33037,"Machine-tools; for deburring, grinding, polishing or otherwise finishing metal, sintered metal carbides or cermets by means of grinding stones, abrasives or polishing products, n.e.c. in heading no. 8460",FALSE,,,,,,,,,,,,,,,,
854233,33110,Electronic integrated circuits; amplifiers,FALSE,,,,,,,,,,,,,,,,
640391,33340,"Footwear; n.e.c. in heading no. 6403, covering the ankle, outer soles of rubber, plastics or composition leather, uppers of leather",FALSE,,,,,,,,,,,,,,,,
841239,33450,"Engines; pneumatic power engines and motors, other than linear acting (cylinders)",FALSE,,,,,,,,,,,,,,,,
854110,33477,"Electrical apparatus; diodes, other than photosensitive or light-emitting diodes (LED)",FALSE,,,,,,,,,,,,,,,,
611012,33514,"Jerseys, pullovers, cardigans, waistcoats and similar articles; knitted or crocheted, of fibres from kashmir (cashmere) goats",FALSE,,,,,,,,,,,,,,,,
631010,34835,"Rags; used or new, scrap twine, cordage, rope and cables and worn out articles of twine, cordage, rope or cables, of textile materials; sorted",FALSE,,,,,,,,,,,,,,,,
481710,35230,Paper and paperboard; envelopes,FALSE,,,,,,,,,,,,,,,,
820720,35285,"Tools, interchangeable; (for machine or hand tools, whether or not power-operated), dies for drawing or extruding metal",FALSE,,,,,,,,,,,,,,,,
430180,36074,"Furskins; raw, of animals n.e.c. in heading no. 4301, whole, with or without head, tail or paws (excluding goods of heading no. 4101, 4102 and 4103)",FALSE,,,,,,,,,,,,,,,,
400300,36202,"Rubber; reclaimed rubber, in primary forms or in plates, sheets or strip",FALSE,,,,,,,,,,,,,,,,
722530,36257,"Steel, alloy; flat-rolled, width 600mm or more, hot-rolled, in coils",FALSE,,,,,,,,,,,,,,,,
220860,36312,Vodka,FALSE,,,,,,,,,,,,,,,,
491191,36441,"Printed matter; pictures, designs and photographs, n.e.c. in item no. 4911.10",FALSE,,,,,,,,,,,,,,,,
851989,36560,Sound recording or reproducing apparatus; n.e.c. in heading no 8519,FALSE,,,,,,,,,,,,,,,,
901831,36753,"Medical, surgical instruments and appliances; syringes, with or without needles",FALSE,,,,,,,,,,,,,,,,
591131,37074,"Textiles; fabrics and felts, endless or fitted with linking devices, of a kind used in paper-making or similar machines, weighing less than 650g/m2",FALSE,,,,,,,,,,,,,,,,
620112,37129,"Coats; men's or boys', overcoats, raincoats, car-coats, capes, cloaks and similar articles, of cotton, other than those of heading no. 6203 (not knitted or crocheted)",FALSE,,,,,,,,,,,,,,,,
850410,37358,Discharge lamps or tubes; ballasts therefor,FALSE,,,,,,,,,,,,,,,,
481920,37422,"Paper and paperboard; folding cartons, boxes and cases, of non-corrugated paper or paperboard",FALSE,,,,,,,,,,,,,,,,
590900,37670,"Textile hosepiping and similar textile tubing; with or without lining, armour or accessories of other materials",FALSE,,,,,,,,,,,,,,,,
690390,37881,"Refractory ceramic goods; composition of which n.e.c. in heading no. 6903, other than those of siliceous fossil meals or similar earths",FALSE,,,,,,,,,,,,,,,,
843840,37890,"Machinery; industrial, brewery machinery",FALSE,,,,,,,,,,,,,,,,
854690,37936,Electrical insulators; other than of glass and ceramics,FALSE,,,,,,,,,,,,,,,,
846591,37964,"Machine-tools; for working wood, cork, bone, hard rubber, hard plastics or similar hard materials; sawing machines",FALSE,,,,,,,,,,,,,,,,
392114,38010,"Plastics; plates, sheets, film, foil and strip, of regenerated cellulose, cellular",FALSE,,,,,,,,,,,,,,,,
170290,38202,"Sugars; n.e.c. in heading no. 1702, including invert sugar and other sugar and sugar syrup blends containing, in the dry state, 50% by weight of fructose",FALSE,,,,,,,,,,,,,,,,
690911,38312,"Ceramic wares; for laboratory, chemical or other technical uses, of porcelain or china",FALSE,,,,,,,,,,,,,,,,
722699,38386,"Steel, alloy; flat-rolled, width less than 600mm, n.e.c. in item no. 7226.9",FALSE,,,,,,,,,,,,,,,,
400922,38670,"Rubber; vulcanised (other than hard rubber), tubing, piping and hoses, reinforced or otherwise combined only with metal, with fittings",FALSE,,,,,,,,,,,,,,,,
482110,38973,"Paper and paperboard; labels or all kinds, printed",FALSE,,,,,,,,,,,,,,,,
851981,39055,"Sound recording or reproducing apparatus; using magnetic, optical or semiconductor media, n.e.c. in item no 8519.20, 8519.30 or 8519.50",FALSE,,,,,,,,,,,,,,,,
401031,39193,"Rubber; vulcanised, endless transmission belts of trapezoidal cross-section (V-belts), V-ribbed, of an outside circumference exceeding 60cm but not exceeding 180 cm",FALSE,,,,,,,,,,,,,,,,
330710,39239,"Perfumery, cosmetic or toilet preparations; pre-shave, shaving or after-shave preparations",FALSE,,,,,,,,,,,,,,,,
853340,39358,"Electrical resistors; variable, including rheostats and potentiometers (excluding heating)",FALSE,,,,,,,,,,,,,,,,
730459,39468,"Steel, alloy (not stainless steel); (excluding cold-drawn or cold-rolled), tubes, pipes and hollow profiles of circular cross-section",FALSE,,,,,,,,,,,,,,,,
900792,39468,"Projectors, cinematographic; parts and accessories, whether or not incorporating sound reproducing apparatus",FALSE,,,,,,,,,,,,,,,,
900791,39588,"Cameras, cinematographic; parts and accessories, whether or not incorporating sound recording apparatus",FALSE,,,,,,,,,,,,,,,,
392510,39679,"Plastics; builders' ware, reservoirs, tanks, vats and similar containers of a capacity exceeding 300 litres",FALSE,,,,,,,,,,,,,,,,
482320,39817,Paper and paperboard; filter paper and paperboard,FALSE,,,,,,,,,,,,,,,,
970200,39909,"Engravings, prints and lithographs; original",FALSE,,,,,,,,,,,,,,,,
871491,39964,"Cycles; frames and forks, and parts thereof",FALSE,,,,,,,,,,,,,,,,
420231,39973,"Cases and containers; of a kind normally carried in the pocket or in the handbag, with outer surface of leather or of composition leather",FALSE,,,,,,,,,,,,,,,,
871639,39982,Trailers and semi-trailers; (other than tanker type),FALSE,,,,,,,,,,,,,,,,
870895,40000,Vehicle parts; safety airbags with inflater system; parts thereof,FALSE,,,,,,,,,,,,,,,,
551219,40175,"Fabrics, woven; of synthetic staple fibres, containing 85% or more by weight of polyester staple fibres, other than unbleached or bleached",FALSE,,,,,,,,,,,,,,,,
950651,40184,Lawn-tennis racquets; whether or not strung,FALSE,,,,,,,,,,,,,,,,
392119,40386,"Plastics; plates, sheets, film, foil and strip, of plastics n.e.c. in heading no. 3921, cellular",FALSE,,,,,,,,,,,,,,,,
854519,40478,"Carbon electrodes; with or without metal, of a kind used for other than furnaces",FALSE,,,,,,,,,,,,,,,,
950611,40514,Skis; for snow,FALSE,,,,,,,,,,,,,,,,
901510,40560,Rangefinders,FALSE,,,,,,,,,,,,,,,,
293349,40982,"Heterocyclic compounds; containing a quinoline or isoquinoline ring-system (whether or not hydrogenated) in the structure, not further fused, other than levorphanol (INN) and its salts",FALSE,,,,,,,,,,,,,,,,
732111,41854,"Cooking appliances and plate warmers; for gas fuel or for both gas and other fuels, of iron or steel",FALSE,,,,,,,,,,,,,,,,
400942,42523,"Rubber; vulcanised (other than hard rubber), tubing, piping and hoses, reinforced or otherwise combined with materials other than metal or textiles, with fittings",FALSE,,,,,,,,,,,,,,,,
848280,42753,"Bearings; n.e.c. in heading no. 8482, including combined ball/roller",FALSE,,,,,,,,,,,,,,,,
846789,43092,"Tools; for working in the hand, (other than chain saws), hydraulic or with self-contained non-electric motor, (not pneumatic)",FALSE,,,,,,,,,,,,,,,,
620333,43101,"Jackets and blazers; men's or boys', of synthetic fibres (not knitted or crocheted)",FALSE,,,,,,,,,,,,,,,,
810330,43368,Tantalum; waste and scrap,FALSE,,,,,,,,,,,,,,,,
848320,44065,"Bearing housings, incorporating ball or roller bearings",FALSE,,,,,,,,,,,,,,,,
330113,44294,"Oils, essential; of lemon (terpeneless or not), including concretes and absolutes",FALSE,,,,,,,,,,,,,,,,
820590,44523,"Tools, hand; n.e.c. in heading 8205, including anvils, portable forges, hand or pedal-operated grinding wheels with frameworks, and sets of articles of two or more of the subheadings in heading 8205",FALSE,,,,,,,,,,,,,,,,
701790,44735,"Glassware; laboratory, hygienic or pharmaceutical, whether or not graduated or calibrated, of glass n.e.c. in heading no. 7017",FALSE,,,,,,,,,,,,,,,,
610210,44817,"Coats; women's or girls' overcoats, car-coats, capes, anoraks, wind-jackets and similar articles, of wool or fine animal hair, knitted or crocheted (excluding those of heading no. 6104)",FALSE,,,,,,,,,,,,,,,,
851890,45294,"Microphones, headphones, earphones, amplifier equipment; parts of the equipment of heading no. 8518",FALSE,,,,,,,,,,,,,,,,
190520,45542,"Food preparations; gingerbread and the like, whether or not containing cocoa",FALSE,,,,,,,,,,,,,,,,
610130,45588,"Coats; men's or boys' overcoats, car-coats, capes, anoraks, wind-jackets and similar articles, of man-made fibres, knitted or crocheted, (excluding those of heading no. 6103)",FALSE,,,,,,,,,,,,,,,,
847230,45872,"Office machines; for sorting or folding mail or for inserting mail in envelopes or bands, machines for opening, closing or sealing mail and machines for affixing or cancelling postage stamps",FALSE,,,,,,,,,,,,,,,,
711311,45918,"Jewellery; of silver, whether or not plated or clad with other precious metal, and parts thereof",FALSE,,,,,,,,,,,,,,,,
731029,45982,"Tanks, casks, drums, boxes and similar containers for any material (excluding compressed or liquefied gas) less than 50l capacity, n.e.c. in item no. 7310.2, of iron or steel",FALSE,,,,,,,,,,,,,,,,
190240,46505,Food preparations; couscous,FALSE,,,,,,,,,,,,,,,,
711590,46982,"Metal; precious or metal clad with precious metal, other than that of item no. 7115.10",FALSE,,,,,,,,,,,,,,,,
720421,47046,Ferrous waste and scrap; of stainless steel,FALSE,,,,,,,,,,,,,,,,
741121,47267,"Copper; tubes and pipes, of copper-zinc base alloys (brass)",FALSE,,,,,,,,,,,,,,,,
610230,47404,"Coats; women's or girls' overcoats, car-coats, capes, anoraks, wind-jackets and similar articles, of man-made fibres, knitted or crocheted (excluding those of heading no. 6104)",FALSE,,,,,,,,,,,,,,,,
440410,47707,"Wood; coniferous, split poles, piles, pickets, stakes, pointed but not sawn lengthwise; sticks for umbrellas, tool handles etc, roughly trimmed but not turned or bent; chipwood etc, hoopwood",FALSE,,,,,,,,,,,,,,,,
150430,47799,Fats and oils and their fractions; of marine mammals,FALSE,,,,,,,,,,,,,,,,
285000,47891,"Hydrides, nitrides, azides, silicides and borides, whether or not chemically defined, other than compounds which are also carbides of heading no. 2849",FALSE,,,,,,,,,,,,,,,,
321410,47936,Mastics; painters' fillings,FALSE,,,,,,,,,,,,,,,,
853120,48001,"Signalling apparatus; electric, sound or visual, indicator panels incorporating liquid crystal devices (LCD) or light-emitting diodes (LED), excluding those of heading no. 8512 or 8530",FALSE,,,,,,,,,,,,,,,,
846610,48102,Parts & accessories suited for use solely/principally with machines of headings 8456-8465; tool holders and self-opening dieheads,FALSE,,,,,,,,,,,,,,,,
010619,48551,"Mammals; live, other than primates, whales, dolphins, porpoises (mammals of the order Cetacea); manatees, dugongs (mammals of the order Sirenia); seals, sea lions, walruses (mammals of the suborder Pinnipedia), camels, other camelids, rabbits and hares",FALSE,,,,,,,,,,,,,,,,
847340,48569,"Machinery; parts and accessories (other than covers, carrying cases and the like) of the machines of heading no. 8472",FALSE,,,,,,,,,,,,,,,,
950790,48588,"Fishing tackle n.e.c., butterfly nets, decoy birds (other than those of heading no. 9208 or 9705) and similar hunting or shooting requisites",FALSE,,,,,,,,,,,,,,,,
220850,48982,Gin and geneva,FALSE,,,,,,,,,,,,,,,,
847329,49450,"Machinery; parts and accessories of the machines of item no. 8470.30. 8470.50 or 8470.90 (other than covers, carrying cases and the like)",FALSE,,,,,,,,,,,,,,,,
831000,50056,"Sign plates, name-plates, address-plates and similar plates, numbers, letters and other symbols; of base metal, excluding those of heading no. 9405",FALSE,,,,,,,,,,,,,,,,
390130,50102,"Ethylene polymers; in primary forms, ethylene-vinyl acetate copolymers",FALSE,,,,,,,,,,,,,,,,
481149,50102,"Paper and paperboard; gummed or adhesive paper and paperboard (excluding self-adhesive), in rolls or sheets, other than goods of heading no. 4803, 4809, or 4810",FALSE,,,,,,,,,,,,,,,,
010690,50175,"Animals; live, n.e.c. in chapter 01, other than mammals, reptiles, birds and insects",FALSE,,,,,,,,,,,,,,,,
903031,50203,"Multimeters; for measuring or checking voltage, current, resistance or power, without a recording device",FALSE,,,,,,,,,,,,,,,,
391890,50670,"Floor, wall or ceiling coverings; of plastics (excluding polymers of vinyl chloride), whether or not self-adhesive, in rolls or in the form of tiles",FALSE,,,,,,,,,,,,,,,,
441299,51010,"Plywood, veneered panels and similar laminated wood (other than blockboard, laminboard and battenboard, other than of bamboo, and other than plywood consisting only of sheets of wood each ply 6mm or thinner)",FALSE,,,,,,,,,,,,,,,,
281122,51047,Silicon dioxide,FALSE,,,,,,,,,,,,,,,,
621030,51230,"Garments; overcoats, raincoats, car-coats, capes, cloaks and similar articles, women's or girls', of the fabrics of heading no. 5602, 5603, 5903, 5906 or 5907 (not knitted or crocheted)",FALSE,,,,,,,,,,,,,,,,
284390,51404,"Inorganic or organic compounds of precious metals, n.e.c.; amalgams",FALSE,,,,,,,,,,,,,,,,
841231,51735,"Engines; pneumatic power engines and motors, linear acting (cylinders)",FALSE,,,,,,,,,,,,,,,,
350691,51790,"Adhesives; prepared, based on polymers of heading 3901 to 3913 or on rubber",FALSE,,,,,,,,,,,,,,,,
848120,52157,Valves; for oleohydraulic or pneumatic transmissions,FALSE,,,,,,,,,,,,,,,,
851829,52230,Loudspeakers; not mounted in their enclosures,FALSE,,,,,,,,,,,,,,,,
848291,52239,"Bearings; parts, balls, needles and rollers",FALSE,,,,,,,,,,,,,,,,
310590,52744,"Fertilizers, mineral or chemical; n.e.c. in heading no. 3105",FALSE,,,,,,,,,,,,,,,,
820770,53423,"Tools, interchangeable; (for machine or hand tools, whether or not power-operated), for milling",FALSE,,,,,,,,,,,,,,,,
840999,54267,Engines; parts for internal combustion piston engines (excluding spark-ignition),FALSE,,,,,,,,,,,,,,,,
701959,54404,"Glass fibres; woven fabrics (other than of rovings), n.e.c. in item no. 7019.5",FALSE,,,,,,,,,,,,,,,,
390740,54826,Polycarbonates; in primary forms,FALSE,,,,,,,,,,,,,,,,
841790,55038,"Furnaces and ovens; parts of non-electric furnaces and ovens (including incinerators), of industrial or laboratory use",FALSE,,,,,,,,,,,,,,,,
380210,55524,Carbon; activated,FALSE,,,,,,,,,,,,,,,,
850690,55579,"Cells and batteries; primary, parts thereof",FALSE,,,,,,,,,,,,,,,,
950670,55891,"Skates; ice and roller, including skating boots with skates attached",FALSE,,,,,,,,,,,,,,,,
321519,56386,"Ink; for printing, other than black, whether or not concentrated or solid",FALSE,,,,,,,,,,,,,,,,
321000,56524,"Paints and varnishes; (including enamels, lacquers and distempers), prepared water pigments of a kind used for finishing leather",FALSE,,,,,,,,,,,,,,,,
470421,56551,"Wood pulp; chemical wood pulp, sulphite, (other than dissolving grades), semi-bleached or bleached, of coniferous wood",FALSE,,,,,,,,,,,,,,,,
210210,56790,Yeasts; active,FALSE,,,,,,,,,,,,,,,,
620442,57460,"Dresses; women's or girls', of cotton (not knitted or crocheted)",FALSE,,,,,,,,,,,,,,,,
701919,57689,"Glass fibres; (including glass wool), slivers, yarns and threads",FALSE,,,,,,,,,,,,,,,,
850433,59120,"Transformers; n.e.c. in item no. 8504.2, having a power handling capacity exceeding 16kVA but not exceeding 500kVA",FALSE,,,,,,,,,,,,,,,,
440311,59863,"Wood; coniferous species, in the rough, whether or not stripped of bark or sapwood, or roughly squared; treated with paint, stains, creosote or other preservatives",FALSE,,,,,,,,,,,,,,,,
902490,59955,"Machines and appliances; parts and accessories for those testing hardness, strength, compressibility, elasticity or other mechanical properties of materials (e.g. metal, wood, textiles, paper, plastics)",FALSE,,,,,,,,,,,,,,,,
731700,60643,"Iron or steel; nails, tacks, drawing pins, corrugated nails, staples (not those of heading no. 8305) and the like, with heads of other material or not, but excluding articles with heads of copper",FALSE,,,,,,,,,,,,,,,,
820790,60955,"Tools, interchangeable; (for machine or hand tools, whether or not power-operated), for screw-driving or uses n.e.c. in heading no. 8207",FALSE,,,,,,,,,,,,,,,,
870892,60964,Vehicle parts; silencers (mufflers) and exhaust pipes; parts thereof,FALSE,,,,,,,,,,,,,,,,
630710,60983,"Cloths; floor cloths, dish-cloths, dusters and similar cleaning cloths",FALSE,,,,,,,,,,,,,,,,
846792,61524,"Tools; for working in the hand, parts of pneumatic tools",FALSE,,,,,,,,,,,,,,,,
200981,61652,"Juice; Cranberry (Vaccinium macrocarpon, Vaccinium oxycoccos, Vaccinium vitis-idaea) juice, unfermented, not containing added spirit, whether or not containing added sugar or other sweetening matter",FALSE,,,,,,,,,,,,,,,,
960610,62093,"Press-fasteners, snap-fasteners, press-studs and parts therefor",FALSE,,,,,,,,,,,,,,,,
846711,62496,"Tools; for working in the hand, pneumatic, rotary type (including combined rotary-percussion)",FALSE,,,,,,,,,,,,,,,,
392330,62937,"Plastics; carboys, bottles, flasks and similar articles, for the conveyance or packing of goods",FALSE,,,,,,,,,,,,,,,,
730729,63139,"Steel, stainless; tube or pipe fittings, n.e.c. in item no. 7307.2",FALSE,,,,,,,,,,,,,,,,
730799,63487,"Iron or steel; tube or pipe fittings, n.e.c. in item no. 7307.9, other than stainless steel",FALSE,,,,,,,,,,,,,,,,
640291,63882,"Footwear; n.e.c. in heading no. 6402, covering the ankle, with outer soles and uppers of rubber or plastics",FALSE,,,,,,,,,,,,,,,,
851761,63928,Base stations,FALSE,,,,,,,,,,,,,,,,
851190,63992,"Ignition or starting equipment; parts of the equipment of heading no. 8511, for use in spark-ignition or compression-ignition internal combustion engines",FALSE,,,,,,,,,,,,,,,,
570500,64029,"Carpets and other textile floor coverings; n.e.c. in chapter 57, whether or not made up",FALSE,,,,,,,,,,,,,,,,
940370,64166,Furniture; plastic,FALSE,,,,,,,,,,,,,,,,
843320,64937,Mowers; n.e.c. in item no. 8433.1 (including cutter bars for tractor mounting),FALSE,,,,,,,,,,,,,,,,
611710,65341,"Shawls, scarves, mufflers, mantillas, veils and the like; knitted or crocheted",FALSE,,,,,,,,,,,,,,,,
851220,65662,"Lighting or visual signalling equipment; electrical, of a kind used on motor vehicles (excluding articles of heading no. 8539)",FALSE,,,,,,,,,,,,,,,,
731100,65781,"Containers for compressed or liquefied gas, of iron or steel",FALSE,,,,,,,,,,,,,,,,
440797,66010,"Wood; of poplar and aspen (Populus spp.), sawn or chipped lengthwise, sliced or peeled, of a thickness exceeding 6mm, whether or not planed, sanded or finger-jointed",FALSE,,,,,,,,,,,,,,,,
761610,66102,"Aluminium; nails, tacks, staples (other than those of heading no. 8305), screws, bolts, nuts, screw hooks, rivets, cotters, cotter-pins, washers and similar articles",FALSE,,,,,,,,,,,,,,,,
940171,66240,"Seats; with metal frames, upholstered, (excluding medical, surgical, dental, veterinary or barber furniture)",FALSE,,,,,,,,,,,,,,,,
846799,66359,"Tools; for working in the hand, parts thereof for other than chain saws and pneumatic tools",FALSE,,,,,,,,,,,,,,,,
620343,67341,"Trousers, bib and brace overalls, breeches and shorts; men's or boys', of synthetic fibres (not knitted or crocheted)",FALSE,,,,,,,,,,,,,,,,
841410,67423,Pumps; vacuum,FALSE,,,,,,,,,,,,,,,,
870990,67478,Vehicles; parts of the vehicles of heading no. 8709,FALSE,,,,,,,,,,,,,,,,
540753,67689,"Fabrics, woven; containing 85% or more by weight of textured polyester filaments, of yarns of different colours",FALSE,,,,,,,,,,,,,,,,
970500,67808,"Collections and collectors' pieces; of zoological, botanical, mineralogical, anatomical, historical, archaeological, palaeontological, ethnographic or numismatic interest",FALSE,,,,,,,,,,,,,,,,
846620,68047,Parts & accessories suited for use solely/principally with machines of headings 8456-8465; work holders,FALSE,,,,,,,,,,,,,,,,
401170,69019,"Rubber; new pneumatic tyres, of a kind used on agricultural or forestry vehicles and machines",FALSE,,,,,,,,,,,,,,,,
732181,69075,"Domestic appliances; non-electric, (other than cookers and plate warmers), for gas fuel or for both gas and other fuels, of iron or steel",FALSE,,,,,,,,,,,,,,,,
800700,69120,Tin; articles n.e.c. in chapter 80,FALSE,,,,,,,,,,,,,,,,
120925,69368,"Seeds of forage plants; rye grass (Lolium multiflorum Lam., Lolium perenne L.) seeds, of a kind used for sowing",FALSE,,,,,,,,,,,,,,,,
340290,69708,"Washing and cleaning preparations; surface-active, whether or not containing soap (excluding those of heading no. 3401), including auxiliary washing preparations, not for retail sale",FALSE,,,,,,,,,,,,,,,,
843691,70258,Machinery; parts of poultry-keeping machinery or poultry incubators and brooders,FALSE,,,,,,,,,,,,,,,,
841899,70460,"Refrigerating or freezing equipment; parts thereof, other than furniture",FALSE,,,,,,,,,,,,,,,,
843020,70717,Snow-ploughs and snow-blowers,FALSE,,,,,,,,,,,,,,,,
910211,70937,"Wrist-watches; electrically operated, with or without a stop-watch, (other than those of heading no. 9101) with mechanical display only",FALSE,,,,,,,,,,,,,,,,
340119,71102,"Soap and organic surface-active products; in the form of bars, cakes, moulded shapes, and paper, wadding, felt and nonwovens, impregnated, coated or covered with soap or detergent, not for toilet use",FALSE,,,,,,,,,,,,,,,,
321490,71350,Mastics; n.e.c. in heading no. 3214,FALSE,,,,,,,,,,,,,,,,
901210,71387,Microscopes (excluding optical microscopes); diffraction apparatus,FALSE,,,,,,,,,,,,,,,,
220600,72093,"Beverages, fermented; (e.g. cider, perry, mead, sake)",FALSE,,,,,,,,,,,,,,,,
442090,72497,"Wood; marquetry and inlaid wood, caskets and cases for jewellery or cutlery and similar articles of wood, wooden articles of furniture not falling in chapter 94",FALSE,,,,,,,,,,,,,,,,
854790,72671,"Insulating fittings; (other than of ceramics or plastics), for electrical machines, appliances and equipment, excluding insulators of heading no. 8546",FALSE,,,,,,,,,,,,,,,,
160232,72698,"Meat preparations; of the poultry of heading no. 0105, (i.e. of fowls of the species Gallus domesticus)",FALSE,,,,,,,,,,,,,,,,
903281,72955,"Regulating or controlling instruments and apparatus; automatic, hydraulic or pneumatic",FALSE,,,,,,,,,,,,,,,,
610433,73258,"Jackets; women's or girls', of synthetic fibres, knitted or crocheted",FALSE,,,,,,,,,,,,,,,,
820570,74588,"Tools, hand; vices, clamps and the like",FALSE,,,,,,,,,,,,,,,,
820411,74818,"Tools, hand; hand-operated spanners and wrenches (including torque meter wrenches but not including tap wrenches), non-adjustable",FALSE,,,,,,,,,,,,,,,,
392321,74946,"Ethylene polymers; sacks and bags (including cones), for the conveyance or packing of goods",FALSE,,,,,,,,,,,,,,,,
852380,75561,"Media n.e.c. in heading 8523, whether or not recorded, excluding products of Chapter 37",FALSE,,,,,,,,,,,,,,,,
