291550,214729,"Acids; saturated acyclic monocarboxylic acids; propionic acid, its salts and esters",FALSE,,,,,,,,,,,,,,,,
852852,216619,Monitors; other than cathode-ray tube; capable of directly connecting to and designed for use with an automatic data processing machine of heading 84.71,FALSE,,,,,,,,,,,,,,,,
960390,217151,"Brooms, brushes, mops, feather dusters, squeegees, hand operated mechanical floor sweepers; (not motorised), prepared knots and tufts for brooms or brush making n.e.c.",FALSE,,,,,,,,,,,,,,,,
392113,221986,"Plastics; plates, sheets, film, foil and strip, of polyurethanes, cellular",FALSE,,,,,,,,,,,,,,,,
340319,222372,"Lubricating preparations; (other than for the treatment of textile and similar materials), containing less than 70% (by weight) of petroleum oils or oils obtained from bituminous minerals",FALSE,,,,,,,,,,,,,,,,
330430,223133,Cosmetic and toilet preparations; manicure or pedicure preparations,FALSE,,,,,,,,,,,,,,,,
851680,223849,"Resistors; electric heating, other than those of heading no. 8545",FALSE,,,,,,,,,,,,,,,,
400931,226106,"Rubber; vulcanised (other than hard rubber), tubing, piping and hoses, reinforced or otherwise combined only with textile materials, without fittings",FALSE,,,,,,,,,,,,,,,,
300190,226124,"Glands and other organs; heparin and its salts; other human or animal substances prepared for therapeutic or prophylactic uses, n.e.c. in heading 3001",FALSE,,,,,,,,,,,,,,,,
721230,226198,"Iron or non-alloy steel; flat-rolled, width less than 600mm, plated or coated with zinc (not electrolytically)",FALSE,,,,,,,,,,,,,,,,
020641,226509,"Offal, edible; of swine, livers, frozen",FALSE,,,,,,,,,,,,,,,,
903210,226583,"Regulating or controlling instruments and apparatus; automatic type, thermostats",FALSE,,,,,,,,,,,,,,,,
920290,227812,"Musical instruments; string, played other than with a bow (e.g. guitars and harps)",FALSE,,,,,,,,,,,,,,,,
390940,228188,Phenolic resins; in primary forms,FALSE,,,,,,,,,,,,,,,,
481890,231225,"Paper articles; articles of paper, cellulose wadding or fibres, n.e.c. in heading no. 4818",FALSE,,,,,,,,,,,,,,,,
300670,231537,Pharmaceutical goods; Gel preparations designed to be used in human or veterinary medicine as a lubricant for parts of the body for surgical operations or physical examinations or as a coupling agent between the body and medical instruments,FALSE,,,,,,,,,,,,,,,,
440612,233023,"Wood; railway or tramway sleepers (cross-ties), not impregnated, non-coniferous",FALSE,,,,,,,,,,,,,,,,
843390,233858,"Harvesting machinery; parts, including parts of threshing machinery, straw or fodder balers and grass or hay mowers",FALSE,,,,,,,,,,,,,,,,
842539,234455,Winches; capstans; not powered by an electric motor,FALSE,,,,,,,,,,,,,,,,
701952,239455,"Glass fibres; woven fabrics (other than of rovings), of a width exceeding 30cm, plain weave, weighing less than 250g/m2, of filaments measuring per single yarn not more than 136 tex",FALSE,,,,,,,,,,,,,,,,
853400,239519,Circuits; printed,FALSE,,,,,,,,,,,,,,,,
902920,242161,Meters; speed indicators and tachometers; stroboscopes,FALSE,,,,,,,,,,,,,,,,
830210,242326,"Hinges; suitable for furniture, doors, staircases, windows, blinds, coachwork, saddlery, trunks, chests, caskets or the like, of base metal",FALSE,,,,,,,,,,,,,,,,
010511,243510,"Poultry; live, fowls of the species Gallus domesticus, weighing not more than 185g",FALSE,,,,,,,,,,,,,,,,
870340,247482,"Vehicles; with both spark-ignition internal combustion reciprocating piston engine and electric motor for propulsion, incapable of being charged by plugging to external source of electric power",FALSE,,,,,,,,,,,,,,,,
843410,249593,Milking machines,FALSE,,,,,,,,,,,,,,,,
170490,250528,"Sugar confectionery; (excluding chewing gum, including white chocolate), not containing cocoa",FALSE,,,,,,,,,,,,,,,,
842810,253492,Lifts and skip hoists,FALSE,,,,,,,,,,,,,,,,
220300,257850,Beer; made from malt,FALSE,,,,,,,,,,,,,,,,
330590,259052,Hair preparations; n.e.c. in heading no. 3305,FALSE,,,,,,,,,,,,,,,,
330620,260886,Oral or dental hygiene preparations; yarn used to clean between the teeth (dental floss),FALSE,,,,,,,,,,,,,,,,
392410,262437,Plastics; tableware and kitchenware,FALSE,,,,,,,,,,,,,,,,
854150,264565,"Electrical apparatus; photosensitive semiconductor devices n.e.c. in heading no. 8541, including photovoltaic cells, whether or not assembled in modules or made up into panels",FALSE,,,,,,,,,,,,,,,,
392350,265859,"Plastics; stoppers, lids, caps and other closures, for the conveyance or packing of goods",FALSE,,,,,,,,,,,,,,,,
848190,267859,"Taps, cocks, valves and similar appliances; parts thereof",FALSE,,,,,,,,,,,,,,,,
440611,269189,"Wood; railway or tramway sleepers (cross-ties), not impregnated, coniferous",FALSE,,,,,,,,,,,,,,,,
940360,271345,"Furniture; wooden, other than for office, kitchen or bedroom use",FALSE,,,,,,,,,,,,,,,,
790700,276685,Zinc; articles n.e.c. in chapter 79,FALSE,,,,,,,,,,,,,,,,
903010,278061,Instruments and apparatus; for measuring or detecting ionising radiations,FALSE,,,,,,,,,,,,,,,,
200971,279878,"Juice; apple, of a Brix value not exceeding 20, unfermented, (not containing added spirit), whether or not containing added sugar or other sweetening matter",FALSE,,,,,,,,,,,,,,,,
570330,280703,"Carpets and other textile floor coverings; tufted, of man-made textile materials (other than polyamides), whether or not made up",FALSE,,,,,,,,,,,,,,,,
391990,283557,"Plastics; plates, sheets, film, foil, tape, strip, other flat shapes thereof, self-adhesive, other than in rolls of a width not exceeding 20cm",FALSE,,,,,,,,,,,,,,,,
391400,283768,"Ion-exchangers; based on polymers of heading no. 3901 to 3913, in primary forms",FALSE,,,,,,,,,,,,,,,,
590390,285382,"Textile fabrics; impregnated, coated, covered or laminated with plastics, (excluding polyvinyl chloride, polyurethane and those of heading no. 5902)",FALSE,,,,,,,,,,,,,,,,
851440,285648,"Heating equipment; for the heat treatment of materials by induction or dielectric loss, industrial or laboratory, other than furnaces and ovens",FALSE,,,,,,,,,,,,,,,,
842219,287538,Dish washing machines; of other than household type,FALSE,,,,,,,,,,,,,,,,
851539,287988,"Welding machines and apparatus; for arc (including plasma arc) welding of metals, other than fully or partly automatic, whether or not capable of cutting",FALSE,,,,,,,,,,,,,,,,
848420,289355,Seals; mechanical,FALSE,,,,,,,,,,,,,,,,
871410,289355,Motorcycles (including mopeds); parts and accessories,FALSE,,,,,,,,,,,,,,,,
847720,290493,"Machinery; extruders, for working rubber or plastics or for the manufacture of products from these materials",FALSE,,,,,,,,,,,,,,,,
190190,291309,"Food preparations; of flour, meal, starch, malt extract or milk products, for uses n.e.c. in heading no. 1901",FALSE,,,,,,,,,,,,,,,,
902519,294071,"Thermometers and pyrometers; (other than liquid filled, for direct reading), not combined with other instruments",FALSE,,,,,,,,,,,,,,,,
293190,294805,"Organo-inorganic compounds; other than tetramethyl lead, tetraethyl lead, tributyltin compounds, and other organo-phosphorus derivatives",FALSE,,,,,,,,,,,,,,,,
830230,295218,"Mountings, fittings and similar articles; for motor vehicles, of base metal",FALSE,,,,,,,,,,,,,,,,
843699,297190,"Machinery; parts of that machinery for agricultural, horticultural or forestry use n.e.c. in heading no. 8436",FALSE,,,,,,,,,,,,,,,,
842129,298630,"Machinery; for filtering or purifying liquids, n.e.c. in item no. 8421.2",FALSE,,,,,,,,,,,,,,,,
845490,301135,"Machines; parts of converters, ladles, ingot moulds and casting machines, of a kind used in metallurgy or in metal foundries",FALSE,,,,,,,,,,,,,,,,
291814,304117,"Acids; carboxylic acids, (with alcohol function but without other oxygen function), citric acid",FALSE,,,,,,,,,,,,,,,,
850680,306539,"Cells and batteries; primary, (other than manganese dioxide, mercuric oxide, silver oxide, lithium or air-zinc)",FALSE,,,,,,,,,,,,,,,,
120799,308484,"Oil seeds and oleaginous fruits; n.e.c. in heading no. 1207, whether or not broken",FALSE,,,,,,,,,,,,,,,,
854121,309576,"Electrical apparatus; transistors, (other than photosensitive), with a dissipation rate of less than 1W",FALSE,,,,,,,,,,,,,,,,
847780,310273,"Machinery; for working rubber or plastics or for the manufacture of products from these materials, n.e.c. in this chapter",FALSE,,,,,,,,,,,,,,,,
851410,310502,"Furnaces and ovens; electric, for industrial or laboratory use, resistance heated",FALSE,,,,,,,,,,,,,,,,
350211,312603,"Albumins; egg albumin, dried",FALSE,,,,,,,,,,,,,,,,
847170,313814,Units of automatic data processing machines; storage units,FALSE,,,,,,,,,,,,,,,,
731815,313823,"Iron or steel; threaded screws and bolts n.e.c. in item no. 7318.1, whether or not with their nuts or washers",FALSE,,,,,,,,,,,,,,,,
846693,314530,Parts & accessories suited for use solely/principally with machines of headings 8456-8465; n.e.c. in heading no. 8466,FALSE,,,,,,,,,,,,,,,,
482390,325723,"Paper pulp, paper, paperboard, cellulose wadding or webs of cellulose fibres; articles n.e.c. in heading no. 4823",FALSE,,,,,,,,,,,,,,,,
853649,326769,"Electrical apparatus; relays, for a voltage exceeding 60 volts",FALSE,,,,,,,,,,,,,,,,
292149,328558,Amine-function compounds; aromatic monoamines and their derivatives; salts thereof; n.e.c. in item no. 2921.4,FALSE,,,,,,,,,,,,,,,,
391000,330842,Silicones; in primary forms,FALSE,,,,,,,,,,,,,,,,
760612,332402,"Aluminium; plates, sheets and strip, thickness exceeding 0.2mm, alloys, rectangular (including square)",FALSE,,,,,,,,,,,,,,,,
920590,333824,"Musical instruments; wind, other than brass, (eg. clarinet, bagpipes, pipe organs), other than fairground organs and mechanical street organs",FALSE,,,,,,,,,,,,,,,,
846291,340879,"Machine-tools; presses for working metal or metal carbides, n.e.c. in heading no. 8462, hydraulic presses",FALSE,,,,,,,,,,,,,,,,
721720,345613,"Iron or non-alloy steel; wire, plated or coated with zinc",FALSE,,,,,,,,,,,,,,,,
610510,345971,"Shirts; men's or boys', of cotton, knitted or crocheted",FALSE,,,,,,,,,,,,,,,,
843131,346879,"Lifts, skip hoists or escalators; parts thereof",FALSE,,,,,,,,,,,,,,,,
843890,348219,Machinery; parts of those machines used in the industrial preparation or manufacture of food or drink,FALSE,,,,,,,,,,,,,,,,
180632,350907,"Chocolate and other food preparations containing cocoa; in blocks, slabs or bars, (not filled), weighing 2kg or less",FALSE,,,,,,,,,,,,,,,,
901060,353531,Photographic laboratory apparatus and equipment (including cinematographic); projection screens,FALSE,,,,,,,,,,,,,,,,
830249,354081,"Mountings, fittings and similar articles; suitable for other than buildings or furniture, of base metal",FALSE,,,,,,,,,,,,,,,,
851769,355834,"Communication apparatus (excluding telephone sets or base stations); machines for the transmission or reception of voice, images or other data (including wired/wireless networks), n.e.c. in item no. 8517.6",FALSE,,,,,,,,,,,,,,,,
842121,358311,Machinery; for filtering or purifying water,FALSE,,,,,,,,,,,,,,,,
293139,358403,"Organo-inorganic compounds; other organo-phosphorus derivatives, n.e.c. in heading no. 2931",FALSE,,,,,,,,,,,,,,,,
847690,363990,Machines; parts of automatic goods-vending machines,FALSE,,,,,,,,,,,,,,,,
846791,366880,"Tools; for working in the hand, parts of chain saws, with self-contained non-electric motor",FALSE,,,,,,,,,,,,,,,,
250410,366898,"Graphite; natural, in powder or in flakes",FALSE,,,,,,,,,,,,,,,,
920994,367513,"Musical instruments; parts and accessories for the musical instruments the sound of which is produced or must be amplified electrically (e.g. organs, guitars and accordions)",FALSE,,,,,,,,,,,,,,,,
710610,367632,Metals; silver powder,FALSE,,,,,,,,,,,,,,,,
340130,367660,"Organic surface-active products and preparations for washing the skin, in the form of liquid or cream and put up for retail sale, whether or not containing soap",FALSE,,,,,,,,,,,,,,,,
190420,368109,Food preparations; obtained from unroasted cereal flakes or from mixtures of unroasted cereal flakes and roasted cereal flakes or swelled cereals,FALSE,,,,,,,,,,,,,,,,
841290,368898,"Engines; parts, for engines and motors of heading no. 8412",FALSE,,,,,,,,,,,,,,,,
380991,369972,"Finishing agents and dye carriers; to accelerate dyeing or fixing of dye-stuffs, other products and preparations, used in the textile industry (excluding those with a basis of amylaceous substances)",FALSE,,,,,,,,,,,,,,,,
320910,373008,"Paints and varnishes; based on acrylic or vinyl polymers, dispersed or dissolved in an aqueous medium",FALSE,,,,,,,,,,,,,,,,
940290,373907,"Furniture; for medical, surgical, veterinary use (e.g. operating tables, examination tables, hospital beds with mechanical fittings) and parts thereof",FALSE,,,,,,,,,,,,,,,,
392390,374412,Plastics; articles for the conveyance or packing of goods n.e.c. in heading no. 3923,FALSE,,,,,,,,,,,,,,,,
121190,374880,"Plants and parts (including seeds and fruits) n.e.c. in heading no. 1211, of a kind used primarily in perfumery, in pharmacy or for insecticidal, fungicidal or similar purposes, fresh, chilled, frozen or dried, whether or not cut, crushed or powdered",FALSE,,,,,,,,,,,,,,,,
120923,375008,"Seeds of forage plants; fescue seeds, of a kind used for sowing",FALSE,,,,,,,,,,,,,,,,
391721,376440,"Plastics; tubes, pipes and hoses thereof, rigid, of polymers of ethylene",FALSE,,,,,,,,,,,,,,,,
850161,383054,"Generators; AC generators, (alternators), of an output not exceeding 75kVA",FALSE,,,,,,,,,,,,,,,,
900110,385761,"Optical fibres, optical fibre bundles and cables; excluding those of heading no. 8544",FALSE,,,,,,,,,,,,,,,,
900190,389981,"Optical elements; lenses n.e.c. in heading no. 9001, prisms, mirrors and other optical elements, unmounted, of any material (excluding elements of glass not optically worked)",FALSE,,,,,,,,,,,,,,,,
292119,393101,"Amine-function compounds; acyclic monoamines and their derivatives, and salts thereof, n.e.c. in item no. 2921.1",FALSE,,,,,,,,,,,,,,,,
810890,394000,"Titanium; other than unwrought, n.e.c. in heading no. 8108",FALSE,,,,,,,,,,,,,,,,
902910,396825,"Meters and counters; revolution counters, production counters, taximeters, mileometers, pedometers and the like",FALSE,,,,,,,,,,,,,,,,
820559,399596,"Tools, hand; other hand tools (including glaziers diamonds), excluding household tools, drilling, threading or tapping tools, hammers and sledge hammers, planes, chisels, gouges and similar cutting tools for working wood, and screwdrivers",FALSE,,,,,,,,,,,,,,,,
441820,400569,Wood; doors and their frames and thresholds,FALSE,,,,,,,,,,,,,,,,
847410,400807,"Machines; for sorting, screening, separating or washing earth, stone, ores or other mineral substances",FALSE,,,,,,,,,,,,,,,,
350610,401257,"Glues or adhesives; prepared, products suitable for use as glues or adhesives, put up for retail sale as glues or adhesives, not exceeding a net weight of 1kg",FALSE,,,,,,,,,,,,,,,,
846729,404826,"Tools; for working in the hand, with self-contained electric motor; other than saws and drills",FALSE,,,,,,,,,,,,,,,,
900850,405945,"Image projectors, photographic enlargers and reducers, excluding cinematographic",FALSE,,,,,,,,,,,,,,,,
722592,411129,"Steel, alloy; flat-rolled, width 600mm or more, n.e.c. in heading no. 7225, plated or coated with zinc (other than electrolytically)",FALSE,,,,,,,,,,,,,,,,
440890,411697,"Wood; n.e.c. in heading no. 4408, sheets for veneer or plywood, other wood sawn lengthwise, sliced or peeled, whether or not planed, sanded or end-jointed, not exceeding 6mm in thickness",FALSE,,,,,,,,,,,,,,,,
850720,414000,"Electric accumulators; lead-acid, (other than for starting piston engines), including separators, whether or not rectangular (including square)",FALSE,,,,,,,,,,,,,,,,
251990,418514,"Magnesia, fused or dead-burned (sintered); whether or not containing small quantities of other oxides added before sintering, other magnesium oxide, whether or not pure, (not natural magnesium carbonate)",FALSE,,,,,,,,,,,,,,,,
020690,418523,"Offal, edible; of sheep, goats, horses, asses, mules or hinnies, frozen",FALSE,,,,,,,,,,,,,,,,
650500,424918,"Hats and other headgear; knitted or crocheted, or made up from lace, felt or other textile fabric, in the piece (but not in strips), whether or not lined or trimmed; hair-nets of any material, whether or not lined or trimmed",FALSE,,,,,,,,,,,,,,,,
281129,427239,"Inorganic oxygen compounds; of non-metals, n.e.c. in item no. 2811.2",FALSE,,,,,,,,,,,,,,,,
780191,439680,"Lead; unwrought, unrefined, containing by weight antimony as the principal other element",FALSE,,,,,,,,,,,,,,,,
080929,440313,"Fruit, edible; cherries, other than sour cherries (Prunus cerasus), fresh",FALSE,,,,,,,,,,,,,,,,
842489,443983,"Mechanical appliances; for projecting, dispersing or spraying liquids or powders, for other than agricultural or horticultural use, whether or not hand-operated",FALSE,,,,,,,,,,,,,,,,
842839,448093,"Elevators and conveyors; continuous-action, for goods or materials, n.e.c. in item no. 8428.20, 8428.31, 8428.32 or 8428.33",FALSE,,,,,,,,,,,,,,,,
300220,448662,Vaccines; for human medicine,FALSE,,,,,,,,,,,,,,,,
843110,449652,Machinery; parts of the machinery of heading no. 8425,FALSE,,,,,,,,,,,,,,,,
870322,454717,"Vehicles; with only spark-ignition internal combustion reciprocating piston engine, cylinder capacity over 1000 but not over 1500cc",FALSE,,,,,,,,,,,,,,,,
440794,457341,"Wood; cherry (Prunus spp.), sawn or chipped lengthwise, sliced or peeled, whether or not planed, sanded or end-jointed, thicker than 6mm",FALSE,,,,,,,,,,,,,,,,
840991,458698,"Engines; parts, suitable for use solely or principally with spark-ignition internal combustion piston engines (for other than aircraft)",FALSE,,,,,,,,,,,,,,,,
731816,464194,Iron or steel; threaded nuts,FALSE,,,,,,,,,,,,,,,,
950699,470680,Equipment for outdoor games and recreation n.e.c. in heading no. 9506,FALSE,,,,,,,,,,,,,,,,
392099,481598,"Plastics; plates, sheets, film, foil and strip (not self-adhesive), of plastics n.e.c. in heading no. 3920, non-cellular and not reinforced, laminated, supported or similarly combined with other materials",FALSE,,,,,,,,,,,,,,,,
844332,485341,"Printing, copying, and facsimile machines; single-function printing, copying or facsimile machines, capable of connecting to an automatic data processing machine or to a network",FALSE,,,,,,,,,,,,,,,,
853669,486681,"Electrical apparatus; plugs and sockets, for a voltage not exceeding 1000 volts",FALSE,,,,,,,,,,,,,,,,
940510,490286,Chandeliers and other electric ceiling or wall light fittings; excluding those used for lighting public open spaces or thoroughfares,FALSE,,,,,,,,,,,,,,,,
721049,492461,"Iron or non-alloy steel; flat-rolled, width 600mm or more, (not corrugated), plated or coated with zinc (not electrolytically)",FALSE,,,,,,,,,,,,,,,,
330690,494241,Oral or dental hygiene preparations; other than dentifrices,FALSE,,,,,,,,,,,,,,,,
950691,494764,Athletics and gymnastics equipment,FALSE,,,,,,,,,,,,,,,,
848690,501553,Machines and apparatus of heading 8486; parts and accessories,FALSE,,,,,,,,,,,,,,,,
848079,503122,"Moulds; for rubber or plastics, other than injection or compression types",FALSE,,,,,,,,,,,,,,,,
844399,505553,"Printing machinery; parts and accessories, n.e.c. in item no. 8443.91",FALSE,,,,,,,,,,,,,,,,
284510,511718,Heavy water (deuterium oxide),FALSE,,,,,,,,,,,,,,,,
842290,511718,Machinery; parts of machinery of heading no. 8422,FALSE,,,,,,,,,,,,,,,,
760720,512287,"Aluminium; foil, backed with paper, paperboard, plastics or similar backing materials, of a thickness (excluding any backing) not exceeding 0.2mm",FALSE,,,,,,,,,,,,,,,,
810930,518682,Zirconium; waste and scrap,FALSE,,,,,,,,,,,,,,,,
870590,519425,"Vehicles; break-down lorries, road-sweepers, spraying lorries, mobile workshops, mobile radiological units, and other special purpose vehicles n.e.c. in heading no. 8705",FALSE,,,,,,,,,,,,,,,,
900490,522920,"Spectacles, goggles and the like; (other than sunglasses) corrective, protective or other",FALSE,,,,,,,,,,,,,,,,
870410,522957,"Vehicles; dumpers, designed for off-highway use, for transport of goods",FALSE,,,,,,,,,,,,,,,,
903084,524498,"Instruments and apparatus; n.e.c. in heading no. 9030, with a recording device",FALSE,,,,,,,,,,,,,,,,
940130,524663,"Seats; swivel with variable height adjustment, excluding medical, surgical, dental, veterinary or barber furniture",FALSE,,,,,,,,,,,,,,,,
121300,527397,"Cereal straw and husks; unprepared, whether or not chopped, ground, pressed or in the form of pellets",FALSE,,,,,,,,,,,,,,,,
843810,528140,"Machinery; industrial, for bakery and for the manufacture of macaroni, spaghetti or similar products",FALSE,,,,,,,,,,,,,,,,
491199,546251,Printed matter; n.e.c. in heading no. 4911,FALSE,,,,,,,,,,,,,,,,
847141,552682,"Automatic data processing machines; comprising in the same housing at least a central processing unit and an input and output unit, whether or not combined, n.e.c. in item no. 8471.30",FALSE,,,,,,,,,,,,,,,,
440796,554793,"Wood; of birch (Betula spp.), sawn or chipped lengthwise, sliced or peeled, of a thickness exceeding 6mm, whether or not planed, sanded or finger-jointed",FALSE,,,,,,,,,,,,,,,,
843069,556572,"Machinery; for moving, levelling, scraping, grading, excavating earth minerals or ores; not self propelled n.e.c in 84.30",FALSE,,,,,,,,,,,,,,,,
810590,557591,Cobalt; articles n.e.c. in heading no. 8105,FALSE,,,,,,,,,,,,,,,,
252930,560793,Leucite; nepheline and nepheline syenite,FALSE,,,,,,,,,,,,,,,,
650610,561692,"Headgear; safety, whether or not lined or trimmed",FALSE,,,,,,,,,,,,,,,,
200897,569811,"Fruit, nuts and other edible parts of plants; mixtures (other than those of subheading no 2008.19); prepared or preserved in ways n.e.c. in headings 2007 and 2008, whether or not containing added sugar, or other sweetening matter or spirit, n.e.c.",FALSE,,,,,,,,,,,,,,,,
842710,569921,"Fork-lift and other works trucks; fitted with lifting or handling equipment, self-propelled by electric motor",FALSE,,,,,,,,,,,,,,,,
281820,571389,Aluminium oxide; other than artificial corundum,FALSE,,,,,,,,,,,,,,,,
320820,581637,"Paints and varnishes; based on acrylic or vinyl polymers, dispersed or dissolved in a non-aqueous medium",FALSE,,,,,,,,,,,,,,,,
847740,582325,"Machinery; vacuum moulding machines and other thermoforming machines, for working rubber or plastics or for the manufacture of products from these materials",FALSE,,,,,,,,,,,,,,,,
852550,583270,"Transmission apparatus for radio-broadcasting or television, whether or not incorporating sound recording or reproducing apparatus, not incorporating reception apparatus",FALSE,,,,,,,,,,,,,,,,
841940,584169,Distilling or rectifying plant; not used for domestic purposes,FALSE,,,,,,,,,,,,,,,,
040690,587399,"Dairy produce; cheese (not grated, powdered or processed), n.e.c. in heading no. 0406",FALSE,,,,,,,,,,,,,,,,
440326,587656,"Wood; coniferous species n.e.c in headings 4403.22 or 4403.24, in the rough, whether or not stripped of bark or sapwood, or roughly squared, untreated, of which any cross-sectional dimension is less than 15 cm",FALSE,,,,,,,,,,,,,,,,
871620,600445,"Trailers and semi-trailers; self-loading or self-unloading, for agricultural purposes",FALSE,,,,,,,,,,,,,,,,
920992,608326,Musical instruments; parts and accessories for string musical instruments other than keyboard instruments,FALSE,,,,,,,,,,,,,,,,
380894,612821,Disinfectants; other than containing goods specified in Subheading Note 1 in this Chapter; put up in forms or packings for retail sale or as preparations or articles,FALSE,,,,,,,,,,,,,,,,
810820,614776,"Titanium; unwrought, powders",FALSE,,,,,,,,,,,,,,,,
401120,615445,"Rubber; new pneumatic tyres, of a kind used on buses or lorries",FALSE,,,,,,,,,,,,,,,,
901190,615886,"Microscopes, compound optical; parts and accessories (including those for photomicrography, cinephotomicrography or microprojection)",FALSE,,,,,,,,,,,,,,,,
851140,619510,"Ignition or starting equipment; starter motors and dual purpose starter-generators, of a kind used for spark or compression-ignition internal combustion engines",FALSE,,,,,,,,,,,,,,,,
420100,626042,"Saddlery and harness; for any animal (including traces, leads, knee pads, muzzles, saddle cloths, saddle bags, dog coats and the like), of any materials",FALSE,,,,,,,,,,,,,,,,
120929,630290,"Seeds of forage plants; other than lucerne, clover, fescue, Kentucky blue grass, and rye grass seeds, of a kind used for sowing",FALSE,,,,,,,,,,,,,,,,
230240,630464,"Bran, sharps and other residues; of other cereals, whether or not in the form of pellets, derived from the sifting, milling or other workings thereof",FALSE,,,,,,,,,,,,,,,,
852869,631969,"Projectors; n.e.c. in subheading 8528.62, whether or not colour",FALSE,,,,,,,,,,,,,,,,
420291,633244,"Cases and containers; n.e.c. in heading 4202, with outer surface of leather or of composition leather",FALSE,,,,,,,,,,,,,,,,
870321,639345,"Vehicles; with only spark-ignition internal combustion reciprocating piston engine, cylinder capacity not over 1000cc",FALSE,,,,,,,,,,,,,,,,
100830,640758,Cereals; canary seeds,FALSE,,,,,,,,,,,,,,,,
843930,641905,Machinery; for finishing paper or paperboard,FALSE,,,,,,,,,,,,,,,,
850132,642152,"Electric motors and generators; DC, of an output exceeding 750W but not exceeding 75kW",FALSE,,,,,,,,,,,,,,,,
842833,642565,"Elevators and conveyors; continuous-action, for goods or materials, belt type, n.e.c. in item no. 8428.20 or 8428.31",FALSE,,,,,,,,,,,,,,,,
940340,650602,"Furniture; wooden, for kitchen use",FALSE,,,,,,,,,,,,,,,,
841319,650648,"Pumps; for liquids, fitted or designed to be fitted with a measuring device, other than pumps for dispensing fuel or lubricants",FALSE,,,,,,,,,,,,,,,,
901490,654098,Navigational instruments and appliances; parts and accessories,FALSE,,,,,,,,,,,,,,,,
