HScode,TradeValue,Description,hasGain,Tariff before CPTPP,Japan Rate for Canada TPP,ROC Gain - No Export Promotion,BC Gain - no export promotion,AB Gain - no export promotion,SK Gain - no export promotion,MB Gain - no export promotion,Western Canada Gain - no export promotion,Total Canada Gain - no export promotion,ROC Gain %,BC%,AB%,SK%,MB%,Western Canada Gain %,Total Canada Gain %
090122,2293,"Coffee; roasted, decaffeinated",TRUE,0.12,1,8,736,,,,736,744,54.8,50.4,0,,,50,50
030569,2844,"Fish; salted or in brine, not dried or smoked, other than edible fish offal, n.e.c. in item no. 0305.6",TRUE,0.098,1,,39,,,,39,39,0,38.6,0,,,39,39
640399,3302,"Footwear; n.e.c. in heading no. 6403, (not covering the ankle), outer soles of rubber, plastics or composition leather, uppers of leather",TRUE,0.398,1,713,41,,,,41,754,1490.8,1504.1,0,,,1504,1492
090230,4559,"Tea, black; (fermented) and partly fermented tea, in immediate packings of a content not exceeding 3kg",TRUE,0.145,1,42,9,,,,9,51,71.8,71.8,0,,,72,72
220299,7669,"Non-alcoholic beverages; other than non-alcoholic beer, n.e.c. in item no. 2202.10, not including fruit or vegetable juices of heading no. 2009",TRUE,0.115,1,14,2,,,,2,16,28.5,28.5,0,,,28,28
610990,9605,"T-shirts, singlets and other vests; of textile materials (other than cotton), knitted or crocheted",TRUE,0.0915,1,17,85,,,,85,102,101.5,103.8,0,,,104,103
220410,9697,Wine; sparkling,TRUE,0.2879,1,62,35,4,,,39,101,78.9,78.9,79,,,79,79
151319,10385,"Vegetable oils; coconut (copra) oil and its fractions, other than crude, whether or not refined, but not chemically modified",TRUE,0.045,1,,,,31,7,39,39,0,,0,34.3,34.1,34,34
190532,11431,"Food preparations; waffles and wafers, whether or not containing cocoa",TRUE,0.18,1,7,45,8,,,54,60,93.3,93.6,94,,,94,94
640192,12926,"Footwear; waterproof, covering the ankle (but not the knee), rubber or plastic outer soles and uppers (not assembled by stitch, rivet, nail, screw, plug or similar)",TRUE,0.1685,1,168,1,,,,1,169,250.7,258.3,0,,,258,251
200799,13339,"Jams, fruit jellies, marmalades, purees and pastes; of fruit or nuts n.e.c. in heading no. 2007, cooked preparations (excluding homogenised), whether or not containing added sugar or other sweetening matter",TRUE,0.2103,1,113,12,,,,12,125,113.7,113.7,0,,,114,114
620462,15560,"Trousers, bib and brace overalls, breeches and shorts; women's or girls', of cotton (not knitted or crocheted)",TRUE,0.0955,1,58,1,,,18,20,77,103.7,107.3,0,,101.9,102,103
430310,18835,Furskin articles; apparel and clothing accessories,TRUE,0.2,1,179,1,,,0,2,181,282.7,284.5,0,,284.5,284,283
640419,20110,"Footwear; (other than sportswear), with outer soles of rubber or plastics and uppers of textile materials",TRUE,0.6505,1.1098,2140,0,,,,0,2141,2410,2482.7,0,,,2483,2410
392520,29009,"Plastics; builders' ware, doors, windows and their frames and thresholds for doors",TRUE,0.039,1,0,14,1,,,14,15,28.7,28.7,29,,,29,29
151710,35633,Margarine; excluding liquid margarine,TRUE,0.298,1,,4,703,,,707,707,0,333.8,242,,,242,242
220710,36560,Undenatured ethyl alcohol; of an alcoholic strength by volume of 80% vol. or higher,TRUE,0.0226,1,,,4,,,4,4,0,,5,,,5,5
620342,39349,"Trousers, bib and brace overalls, breeches and shorts; men's or boys', of cotton (not knitted or crocheted)",TRUE,0.0955,1,51,14,,,0,14,66,103,110,0,,101.6,110,104
020742,40221,"Meat and edible offal; of ducks, not cut in pieces, frozen",TRUE,0.096,1,345,,19,,,19,364,103.1,,105,,,105,103
382440,40615,"Cements, mortars or concretes; their prepared additives",TRUE,0.026,1,,16,,,,16,16,0,16,0,,,16,16
420310,60295,"Apparel; articles of apparel, of leather or of composition leather",TRUE,0.13,1,229,0,0,,,0,229,146,149.9,149,,,150,146
441239,79231,"Plywood; consisting only of sheets of wood (not bamboo), each ply 6mm or thinner, with both outer plies of coniferous wood",TRUE,0.06,1,,314,,,,314,314,0,40.5,0,,,40,40
330749,84882,"Perfumes and deodorizers; perfuming or deodorizing preparations for rooms, (excluding those which operate by burning)",TRUE,0.039,1,75,15,,,,15,90,28.6,28.5,0,,,28,29
330129,85121,"Oils, essential; n.e.c. in heading no. 3301 (terpeneless or not), including concretes and absolutes",TRUE,0.0154,1,5,10,,,,10,15,10.6,10.5,0,,,11,11
711319,85130,"Jewellery; of precious metal (excluding silver) whether or not plated or clad with precious metal, and parts thereof",TRUE,0.0533,1,306,13,34,,,47,353,47.7,47.7,48,,,48,48
621133,101965,"Track suits and other garments n.e.c.; men's or boys', of man-made fibres (not knitted or crocheted)",TRUE,0.1095,1,49,73,0,,,73,121,117,116.4,118,,,116,117
150600,104057,"Animal fats and oils and their fractions; whether or not refined, but not chemically modified, n.e.c. in chapter 15",TRUE,0.064,1,23,,67,,,67,90,63.4,,59,,,59,60
420500,105158,"Leather articles; n.e.c. in chapter 42, of leather or composition leather",TRUE,0.1043,1,306,0,16,,0,16,323,119.5,122.5,111,,122.5,112,119
081030,106764,"Fruit, edible; black, white or red currants and gooseberries, fresh",TRUE,0.06,1,,11,,,,11,11,0,13.4,0,,,13,13
051191,109250,"Animal products; of fish or crustaceans, molluscs or other aquatic invertebrates; dead animals of chapter 03, unfit for human consumption",TRUE,0.0043,1,0,2,,,,2,2,1.7,1.7,0,,,2,2
611030,110956,"Jerseys, pullovers, cardigans, waistcoats and similar articles; of man-made fibres, knitted or crocheted",TRUE,0.1045,1,86,57,1,,1,58,145,118.2,125.9,124,,119.5,126,121
761090,121479,"Aluminium; structures (excluding prefabricated buildings of heading no. 9406) and parts of structures, n.e.c. in heading no. 7610, plates, rods, profiles, tubes and the like",TRUE,0.03,1,12,9,0,,,9,20,24.8,24.9,24,,,25,25
071340,129553,"Vegetables, leguminous; lentils, shelled, whether or not skinned or split, dried",TRUE,0.0425,1,1,1,,16,,17,18,16.5,16.4,0,16.5,,16,16
170410,131342,"Sugar confectionery; chewing gum, whether or not sugar-coated, not containing cocoa",TRUE,0.24,1,135,,,,,,135,134.2,,0,,,0,134
081340,139214,"Fruit, edible; fruit n.e.c. in heading no. 0812, dried",TRUE,0.087,1,7,20,,,,20,27,36,35.5,0,,,35,36
621020,139645,"Garments; overcoats, raincoats, car-coats, capes, cloaks and similar articles, men's or boys', of the fabrics of heading no. 5602, 5603, 5903, 5906 or 5907 (not knitted or crocheted)",TRUE,0.0955,1,0,88,,,,88,88,104.7,103.1,0,,,103,103
160300,147755,"Extracts and juices; of meat, fish or crustaceans, molluscs or other aquatic invertebrates",TRUE,0.108,1,78,,,,,,78,142.1,,0,,,0,142
611430,155297,"Garments; of man-made fibres, knitted or crocheted, n.e.c. in chapter 61",TRUE,0.081,1,116,134,3,,,137,253,85.6,92.1,86,,,92,89
090121,167829,"Coffee; roasted, not decaffeinated",TRUE,0.12,1,473,57,,,,57,530,57.2,57.2,0,,,57,57
030481,177215,"Fish fillets; frozen, salmon, Pacific (Oncorhynchus nerka, Oncorhynchus gorbuscha, Oncorhynchus keta, Oncorhynchus tschawytscha, Oncorhynchus kisutch, Oncorhynchus masou, Oncorhynchus rhodurus), Atlantic (Salmo salar), and Danube (Hucho hucho)",TRUE,0.035,1,,80,,,,80,80,0,14.7,0,,,15,15
160411,177637,"Fish preparations; salmon, prepared or preserved, whole or in pieces (but not minced)",TRUE,0.096,1,71,139,,,,139,210,44.1,44.2,0,,,44,44
610120,203472,"Coats; men's or boys' overcoats, car-coats, capes, anoraks, wind-jackets and similar articles, of cotton, knitted or crocheted (excluding those of heading no. 6103)",TRUE,0.109,1,65,152,,,,152,217,129.5,130.6,0,,,131,130
151590,213408,"Vegetable fats and oils and their fractions; fixed, n.e.c. in heading no. 1515, whether or not refined, but not chemically modified",TRUE,0.0169,1,3,7,5,7,12,31,35,11.7,11.7,12,11.6,11.6,12,12
030399,213555,"Fish; frozen, fish fins (other than shark fins), heads, tails, maws and other edible fish offal",TRUE,0.0422,1,,5,,,,5,5,0,16.5,0,,,16,16
030822,214271,"Aquatic invertebrates; sea urchins (Strongylocentrotus spp., Paracentrotus lividus, Loxechinus albus, Echinus esculentus), frozen",TRUE,0.07,1,,19,,,,19,19,0,22.6,0,,,23,23
151499,215500,"Vegetable oils; excluding low erucic acid rape or colza oil and its fractions, other than crude, but not chemically modified",TRUE,0.0479,1,6,137,,67,,204,210,30,21.7,0,27.2,,23,23
420292,220638,"Cases and containers; n.e.c. in heading 4202, with outer surface of sheeting of plastics or of textile materials",TRUE,0.08,1,84,178,1,,0,180,263,87.8,88.5,89,,88.5,88,88
151790,235702,"Edible mixtures or preparations of animal or vegetable fats or oils or of fractions of different fats or oils of this chapter, other than edible fats or oils of heading no. 1516",TRUE,0.0792,1,1,112,,,,112,113,99.5,85.1,0,,,85,85
610443,245785,"Dresses; women's or girls', of synthetic fibres, knitted or crocheted",TRUE,0.109,1,100,0,,,,0,100,123,143.6,0,,,144,123
090921,247015,"Spices; coriander seeds, neither crushed nor ground",TRUE,0.03,1,26,0,,41,,41,67,17.8,20.3,0,20,,20,19
350790,254721,Enzymes and prepared enzymes; other than rennet and concentrates thereof,TRUE,0.039,1,1,40,,,,40,41,28.7,28.6,0,,,29,29
030541,261914,"Fish; smoked, whether or not cooked before or during smoking, salmon, Pacific (Oncorhynchus nerka, gorbuscha, keta, tschawytscha, kisutch, masou, rhodurus), Atlantic (Salmo salar) and Danube (Hucho hucho), includes fillets, but excludes edible fish offal",TRUE,0.105,1,12,74,,,,74,87,48.9,47.1,0,,,47,47
440810,263602,"Wood; coniferous, sheets for veneering (including those obtained by slicing laminated wood), for plywood or similar laminated wood and other wood, sawn lengthwise, sliced or peeled, planed or not, sanded, spliced or end-jointed, not over 6 mm thick",TRUE,0.044,1,6,81,,,,81,88,33.7,33.7,0,,,34,34
220110,277428,"Waters; mineral and aerated, including natural or artificial, (not containing added sugar or other sweetening matter nor flavoured)",TRUE,0.03,1,1,37,,,,37,38,7,7,0,,,7,7
030486,287447,"Fish fillets; frozen, herrings (Clupea harengus, Clupea pallasii)",TRUE,0.1,1,99,5,,,,5,103,44.6,36.7,0,,,37,44
350510,287814,Dextrins and other modified starches,TRUE,0.1405,1,295,0,,,,0,295,69,69.2,0,,,69,69
293499,298484,"Nucleic acids and their salts, other heterocyclic compounds, n.e.c. in heading number 2934",TRUE,0.0103,1,4,0,14,,,14,18,7,7,7,,,7,7
200811,302300,"Nuts; ground-nuts, whether or not containing added sugar, other sweetening matter or spirit",TRUE,0.1828,1,57,,,,,,57,95.6,,0,,,0,96
210610,314723,Protein; concentrates and textured protein substances,TRUE,0.6412,1.016,198,9,5,,839,853,1050,578.6,578.4,579,,538.2,539,546
130219,334475,Vegetable saps and extracts; n.e.c. in item no. 1302.1,TRUE,0.0481,1,109,12,1,0,5,18,127,20.6,20.6,21,20.6,20.1,20,21
030731,349549,"Molluscs; mussels (Mytilus spp., Perna spp.), whether in shell or not, live, fresh or chilled",TRUE,0.07,1,0,30,,,,30,30,18.1,17.6,0,,,18,18
420212,352256,"Cases and containers; trunks, suit-cases, vanity-cases, executive-cases, brief-cases, school satchels and similar containers, with outer surface of plastics or of textile materials",TRUE,0.0953,1,4185,1,0,0,,2,4187,96.2,110.1,108,109,,110,96
081120,358843,"Fruit, edible; raspberries, blackberries, mulberries, loganberries, black, white or red currants and gooseberries, uncooked or cooked, whether or not containing added sugar or other sweetening matter",TRUE,0.078,1,,141,,,,141,141,0,34.3,0,,,34,34
200899,404697,"Fruit, nuts and other edible parts of plants; prepared or preserved, whether or not containing added sugar, other sweetening matter or spirit, n.e.c. in heading no. 2008",TRUE,0.1391,1,252,44,,,,44,296,68.3,68.3,0,,,68,68
151511,426624,"Vegetable oils; linseed oil and its fractions, crude, not chemically modified",TRUE,0.05,1,,4,17,17,,39,39,0,34.7,31,31,,31,31
200893,443900,"Fruit; cranberries (Vaccinium macrocarpon, Vaccinium oxycoccos, Vaccinium vitis-idaea), prepared or preserved, whether or not containing added sugar, other sweetening matter or spirit",TRUE,0.1852,1,234,58,,,,58,292,96.2,95.5,0,,,96,96
611011,446900,"Jerseys, pullovers, cardigans, waistcoats and similar articles; knitted or crocheted, of wool or fine animal hair",TRUE,0.109,1,16,650,,,,650,666,121.2,117.5,0,,,117,118
560210,458139,"Felt; needleloom felt and stitch-bonded fibre fabrics, whether or not impregnated, coated, covered or laminated",TRUE,0.056,1,5,89,,,,89,94,49.9,37.3,0,,,37,38
030617,470424,"Crustaceans; frozen, shrimps and prawns, excluding cold-water varieties, in shell or not, smoked, cooked or not before or during smoking; in shell, cooked by steaming or by boiling in water",TRUE,0.01,1,3,134,,,,134,137,4,4,0,,,4,4
610342,482204,"Trousers, bib and brace overalls, breeches and shorts; men's or boys', of cotton, knitted or crocheted",TRUE,0.109,1,64,137,,,,137,201,127.9,128.9,0,,,129,129
390120,489745,"Ethylene polymers; in primary forms, polyethylene having a specific gravity of 0.94 or more",TRUE,0.065,1,,,226,,,226,226,0,,51,,,51,51
100290,500644,"Cereals; rye, other than seed",TRUE,0.042,1,,,5,16,25,45,45,0,,11,11,11,11,11
620449,502048,"Dresses; women's or girls', of textile materials n.e.c. in item no. 6204.4 (not knitted or crocheted)",TRUE,0.0955,1,316,3,,,,3,319,94.5,98.3,0,,,98,95
030441,512223,"Fish fillets; fresh or chilled, salmon, Pacific (Oncorhynchus nerka, Oncorhynchus gorbuscha, Oncorhynchus keta, Oncorhynchus tschawytscha, Oncorhynchus kisutch, Oncorhynchus masou and Oncorhynchus rhodurus), Atlantic (Salmo salar), Danube (Hucho hucho)",TRUE,0.035,1,,217,,,,217,217,0,14.3,0,,,14,14
110412,539444,"Cereal grains; rolled or flaked, of oats",TRUE,0.12,1,,98,249,8,,354,354,0,55.4,56,56.8,,56,56
620192,550691,"Anoraks (including ski-jackets), wind-cheaters, wind-jackets and similar articles; men's or boys', of cotton, other than those of heading no. 6203 (not knitted or crocheted)",TRUE,0.1095,1,32,52,,,,52,84,125,133,0,,,133,130
160100,551480,"Meat preparations; sausages and similar products, of meat, meat offal or blood, and food preparations based on these products",TRUE,0.1,1,158,85,265,,,350,507,130.7,130.5,130,,,130,130
621040,592096,"Garments; men's or boys', n.e.c. in item no. 6210.2, of the fabrics of heading no. 5602, 5603, 5903, 5906 or 5907 (not knitted or crocheted)",TRUE,0.0955,1,125,390,,,,390,515,107.7,99.3,0,,,99,101
081040,630721,"Fruit, edible; cranberries, bilberries and other fruits of the genus vaccinium, fresh",TRUE,0.06,1,3,68,,,,68,71,24,24,0,,,24,24
610910,635492,"T-shirts, singlets and other vests; of cotton, knitted or crocheted",TRUE,0.0915,1,170,46,,,,46,216,101,100.5,0,,,100,101
070960,644299,"Vegetables; fruits of the genus capsicum or of the genus pimenta, fresh or chilled",TRUE,0.03,1,,22,,,,22,22,0,11.5,0,,,11,11
340399,660345,"Lubricating preparations; other than for the treatment of textile and similar materials, not containing petroleum oils or oils obtained from bituminous minerals",TRUE,0.031,1,26,81,11,,,92,118,22.3,21.1,22,,,21,21
282590,679245,"Inorganic bases, metal oxides, hydroxides and peroxides; n.e.c. in heading no. 2825",TRUE,0.011,1,,,,,42,42,42,0,,0,,5.9,6,6
780110,687511,"Lead; unwrought, refined",TRUE,0.0038,1,,53,,,,53,53,0,3.2,0,,,3,3
200520,693144,"Vegetable preparations; potatoes, prepared or preserved otherwise than by vinegar or acetic acid, not frozen",TRUE,0.1153,1,659,63,6,,,69,728,54.1,54.2,54,,,54,54
030339,727099,"Fish; frozen, flat fish, n.e.c. in item no. 0303.3, excluding fillets, fish meat of 0304, and edible fish offal of subheadings 0303.91 to 0303.99",TRUE,0.035,1,0,139,,,,139,139,14.7,13.8,0,,,14,14
150420,727558,"Fats and oils and their fractions; of fish, (excluding liver-oils)",TRUE,0.07,1,13,150,,,,150,163,80.4,80.2,0,,,80,80
030213,752247,"Fish; fresh or chilled, Pacific salmon (Oncorhynchus nerka, Oncorhynchus gorbuscha, Oncorhynchus keta, Oncorhynchus tschawytscha, Oncorhynchus kisutch, Oncorhynchus masou, Oncorhynchus rhodurus), not fillets, meat of 0304, and edible fish offal of 0302.9",TRUE,0.035,1,,90,,,,90,90,0,8.7,0,,,9,9
621143,807120,"Track suits and other garments n.e.c.; women's or girls', of man-made fibres (not knitted or crocheted)",TRUE,0.1095,1,162,1,0,,,2,163,118.2,123.3,121,,,123,118
200989,840130,"Juice; of any single fruit or vegetable n.e.c. in heading no. 2009, unfermented, not containing added spirit, whether or not containing added sugar or other sweetening matter",TRUE,0.1512,1,403,84,,,,84,487,73.9,74,0,,,74,74
381400,880947,"Solvents and thinners; organic composite solvents and thinners, n.e.c. or included, prepared paint or varnish removers",TRUE,0.039,1,30,133,,,,133,164,28.4,25.3,0,,,25,26
071320,905425,"Vegetables, leguminous; chickpeas (garbanzos), shelled, whether or not skinned or split, dried",TRUE,0.0425,1,34,2,7,56,1,66,100,16.2,16.3,16,16.3,16.3,16,16
020220,925627,"Meat; of bovine animals, cuts with bone in (excluding carcasses and half-carcasses), frozen",TRUE,0.385,1.09,809,6,530,,,536,1346,481.5,519.6,469,,,469,477
220421,932315,"Wine; still, in containers holding 2 litres or less",TRUE,0.1405,1,159,58,,,,58,217,35.3,35.3,0,,,35,35
630790,939031,"Textiles; made up articles (including dress patterns), n.e.c. in chapter 63, n.e.c. in heading no. 6307",TRUE,0.053,1,104,31,0,,,31,135,48.2,50.5,49,,,51,49
200819,1065988,"Nuts and other seeds; whether or not containing added sugar, other sweetening matter or spirit (excluding ground-nuts except in mixtures)",TRUE,0.1035,1,144,,,35,,35,179,48.2,,0,48,,48,48
441899,1110301,"Wood; builders' joinery and carpentry of wood n.e.c. in heading no. 4418, other than of bamboo",TRUE,0.0317,1,204,342,84,,,426,630,23.3,23,23,,,23,23
620113,1341756,"Coats; men's or boys', overcoats, raincoats, car-coats, capes, cloaks and similar articles, of man-made fibres, other than those of heading no. 6203 (not knitted or crocheted)",TRUE,0.1095,1,71,20,,,,20,90,125.1,133.2,0,,,133,127
390190,1553559,"Ethylene polymers; in primary forms, n.e.c. in heading no. 3901",TRUE,0.028,1,313,,906,,,906,1219,19.8,,20,,,20,20
382100,1643222,"Prepared culture media for the development or maintenance of micro-organisms (including viruses and the like) or of plant, human or animal cells",TRUE,0.025,1,0,49,0,,,49,49,17.7,17.4,18,,,17,17
051199,1848988,Animal products; n.e.c. in chapter 5,TRUE,0.0083,1,13,8,1,,,9,22,2.2,2.2,2,,,2,2
440799,1996946,"Wood; sawn or chipped lengthwise, sliced or peeled, of a thickness exceeding 6mm, whether or not planed, sanded or finger-jointed, n.e.c. in heading no. 4407",TRUE,0.024,1,640,94,,,,94,734,16.8,16.8,0,,,17,17
020322,2088728,"Meat; of swine, hams, shoulders and cuts thereof, with bone in, frozen",TRUE,0.5167,1,13575,599,7235,,2010,9844,23419,525.5,498.9,429,,526.4,450,491
761699,2211162,Aluminium; articles n.e.c. in heading 7616,TRUE,0.03,1,44,285,2,,87,373,417,24.8,24.5,25,,24.7,25,25
151519,2211731,"Vegetable oils; linseed oil and its fractions, other than crude, whether or not refined, but not chemically modified",TRUE,0.05,1,,131,2,100,254,487,487,0,28.7,33,31.3,19.8,24,24
030311,2309009,"Fish; frozen, Pacific salmon, sockeye salmon (red salmon) (Oncorhynchus nerka), excluding fillets, fish meat of 0304, and edible fish offal of subheadings 0303.91 to 0303.99",TRUE,0.035,1,,827,,,,827,827,0,13.9,0,,,14,14
210330,2383111,Mustard flour and meal and prepared mustard,TRUE,0.0825,1,204,2,577,,1,580,785,36.3,36.5,32,,36.4,32,33
271019,2434067,"Petroleum oils and oils from bituminous minerals, not containing biodiesel, not crude, not waste oils; preparations n.e.c, containing by weight 70% or more of petroleum oils or oils from bituminous minerals; not light oils and preparations",TRUE,0.0152,1,88,1,667,,,668,756,6.5,6.5,7,,,7,7
392590,2552702,"Plastics; builders' ware, n.e.c. or included in heading no. 3925",TRUE,0.039,1,271,4,4,,41,50,321,28.6,28.7,29,,28.1,28,29
210390,2630264,Sauces and preparations therefor; mixed condiments and mixed seasonings,TRUE,0.0963,1,219,121,,,,121,340,43.9,44.1,0,,,44,44
630900,2760716,"Clothing; worn, and other worn articles",TRUE,0.058,1,912,86,,,,86,998,51.3,51.7,0,,,52,51
293299,3393172,"Heterocyclic compounds; with oxygen hetero-atom(s) only, no lactones or unfused furan rings (hydrogenated or not) in the structure, other than isosafrole, 1-(1,3-benzodiaxol-5-yl) propan-2-one, piperonal, safrole, tetrahydrocannabinols (all isomers)",TRUE,0.031,1,3,433,,,,433,436,22.2,20.3,0,,,20,20
151491,3738042,"Vegetable oils; excluding low erucic acid rape or colza oil and its fractions, crude",TRUE,0.073,1,8,267,,183,,450,457,49.3,40.1,0,50.3,,44,44
070200,4098675,"Vegetables; tomatoes, fresh or chilled",TRUE,0.03,1,139,134,,,,134,274,11.4,11.3,0,,,11,11
020629,4395131,"Offal, edible; of bovine animals, (other than tongues and livers), frozen",TRUE,0.2803,1.03,9371,53,19008,,26,19087,28458,297.9,317.6,255,,310,255,268
071310,4434270,"Vegetables, leguminous; peas (pisum sativum), shelled, whether or not skinned or split, dried",TRUE,1.4247,1,1138,132,14897,47999,706,63734,64871,1575.3,1674.3,1548,1632.7,1659.5,1613,1612
210410,4469280,Soups and broths and preparations therefor,TRUE,0.077,1,62,634,7,,,641,703,34.2,33.6,34,,,34,34
070959,4588861,"Vegetables; truffles and mushrooms (other than of the genus Agaricus), fresh or chilled",TRUE,0.0365,1.009,,634,0,,0,635,635,0,10.1,10,,10.4,10,10
030312,4614201,"Fish; frozen, Pacific salmon (Oncorhynchus gorbuscha/keta/tschawytscha/ kisutch/masou/rhodurus) other than sockeye salmon (Oncorhynchus nerka), excluding fillets, fish meat of 0304, and edible fish offal of subheadings 0303.91 to 0303.99",TRUE,0.035,1,,844,,,,844,844,0,13.6,0,,,14,14
390140,4637899,"Ethylene polymers; in primary forms, ethylene-alpha-olefin copolymers, having a specific gravity of less than 0.94",TRUE,0.028,1,,,504,,,504,504,0,,20,,,20,20
390690,4671799,"Acrylic polymers; (other than polymethyl methacrylate), in primary forms",TRUE,0.0335,1,17,1,,,12,12,29,24.3,24.2,0,,24.3,24,24
811292,4695625,"Gallium, germanium, hafnium, indium, niobium (columbium), rhenium and vanadium; articles thereof, unwrought, including waste and scrap, powders",TRUE,0.0137,1,0,823,,,,823,824,11.9,7.7,0,,,8,8
280300,4782563,Carbon; carbon blacks and other forms of carbon n.e.c.,TRUE,0.039,1,84,,993,,,993,1077,28.5,,27,,,27,27
620293,4939245,"Anoraks (including ski-jackets), wind-cheaters, wind-jackets and similar articles; women's or girls', of man-made fibres, other than those of heading no. 6204 (not knitted or crocheted)",TRUE,0.1095,1,8229,11,,,0,11,8240,112.3,140.7,0,,117.5,140,112
151419,5187196,"Vegetable oils; low erucic acid rape or colza oil and its fractions, other than crude, but not chemically modified",TRUE,0.079,1,20,70,1801,5,262,2138,2157,41.2,41,40,41.2,41.2,40,40
190590,6670764,"Food preparations; bakers' wares n.e.c. in heading no. 1605, whether or not containing cocoa; communion wafers, empty cachets suitable for pharmaceutical use, sealing wafers, rice papers and similar products",TRUE,0.1778,1.0551,320,1232,201,,18,1451,1771,55.2,55,55,,55.2,55,55
284990,6986643,"Carbides; whether or not chemically defined, other than of calcium or silicon",TRUE,0.025,1,906,198,0,,,198,1104,14.9,16.1,17,,,16,15
030351,7541280,"Fish; frozen, herrings (Clupea harengus, Clupea pallasii), excluding fillets, fish meat of 0304, and edible fish offal of subheadings 0303.91 to 0303.99",TRUE,0.06,1,16,652,,,,652,667,25.8,20.8,0,,,21,21
620213,8693215,"Coats; women's or girls', overcoats, raincoats, car-coats, capes, cloaks and similar articles, of man-made fibres, other than those of heading no. 6204 (not knitted or crocheted)",TRUE,0.1095,1,745,0,,,,0,745,119.2,141.8,0,,,142,119
282560,9083463,Germanium oxides and zirconium dioxide,TRUE,0.0195,1,,791,,,,791,791,0,9.9,0,,,10,10
410150,9178695,"Hides and skins; raw, whole, of bovine or equine animals, of a weight per skin exceeding 16 kg",TRUE,0.075,1,2483,1,120,,,121,2604,19.3,20.5,20,,,20,19
750890,9233439,Nickel; articles thereof n.e.c. in item no. 7508.1,TRUE,0.03,1,8,,28,,,28,36,24.9,,25,,,25,25
611020,9474729,"Jerseys, pullovers, cardigans, waistcoats and similar articles; of cotton, knitted or crocheted",TRUE,0.103,1,2655,185,,,0,185,2840,120.7,131.9,0,,125.5,132,121
020649,9511804,"Offal, edible; of swine, (other than livers), frozen",TRUE,0.6235,1,52762,1722,28217,,53214,83153,135915,1658.7,1592.1,868,,922.6,911,1104
071333,9749011,"Vegetables, leguminous; kidney beans, including white pea beans (phaseolus vulgaris), shelled, whether or not skinned or split, dried",TRUE,0.8528,1,7596,3,82,165,245,495,8091,808.9,841.1,829,835.6,836.8,835,810
030391,11177485,"Fish; frozen, livers, roes and milt",TRUE,0.039,1,337,297,,,,297,634,10.1,11.8,0,,,12,11
230990,11507695,"Dog or cat food; (not put up for retail sale), used in animal feeding",TRUE,0.0208,1,170,23,16,,0,39,209,8.6,9.1,10,,8.8,9,9
230910,12558417,"Dog or cat food; put up for retail sale, used in animal feeding",TRUE,0.0093,1,571,15,196,,,211,781,3.7,3.8,4,,,4,4
030389,12928866,"Fish; frozen, n.e.c. in heading 0303, excluding fillets, fish meat of 0304, and edible fish offal of subheadings 0303.91 to 0303.99",TRUE,0.0446,1,714,1413,,,,1413,2128,17.5,16.5,0,,,17,17
040900,14277220,Honey; natural,TRUE,0.255,1,1601,317,4638,752,1231,6939,8540,78.8,78.3,68,76,73.7,70,72
350300,14759488,"Gelatin (including gelatin in rectangular sheets, whether or not surface-worked or coloured) and gelatin derivatives; isinglass; other glues of animal origin, excluding casein glues of heading no. 3501",TRUE,0.1002,1,12854,0,,,,0,12854,66.3,81.4,0,,,81,66
030214,16560632,"Fish; fresh or chilled, Atlantic salmon (Salmo salar) and Danube salmon (Hucho hucho), excluding fillets, fish meat of 0304, and edible fish offal of subheadings 0302.91 to 0302.99",TRUE,0.035,1,6,870,0,,,870,876,8.9,8.9,9,,,9,9
151411,16900410,"Vegetable oils; low erucic acid rape or colza oil and its fractions, crude",TRUE,0.0971,1,127,632,270,515,,1417,1543,70.1,70,70,70.4,,70,70
